{
  "schema_version": "2.0",
  "tow_id": "15",
  "header": {
    "cruise": "SR2529",
    "tow_moc_number": "15",
    "file_name": "SERBCL-15",
    "date": "2026-01-14",
    "local_date": "2026-01-14",
    "gmt_date": "2026-01-14",
    "date_unresolved": false,
    "date_unresolved_reason": null,
    "location": "Carmen",
    "day_night": "Day",
    "direction": "320.4",
    "sea_state": "small waves",
    "wind_speed": "16.8",
    "local_time_from": "12:59",
    "local_time_to": null,
    "gmt_time_from": "19:59",
    "gmt_time_to": null,
    "net_condition": "good",
    "net_mesh": "200um",
    "net_size": "1m\u00b2",
    "net_type": "Vertical",
    "sog": "2.0",
    "operator": "Amy",
    "start_lat": "26 17.035N",
    "start_long": "110 36.892W",
    "end_lat": null,
    "end_long": null
  },
  "form_comments": null,
  "net_tows": [
    {
      "net_number": "0",
      "time_open_local": null,
      "time_close_local": "14:42",
      "time_close_gmt": "21:42",
      "target_depth_m": "0-1000",
      "depth_max_m": "1000.3",
      "depth_min_m": "0",
      "depth_m": null,
      "lat": null,
      "lon": null,
      "angle": "47.4",
      "flow_counts": "1014",
      "volume_filtered": "3962.1",
      "mwo_net": null,
      "winch_speed": "10,10,0",
      "notes_table": "Dragonfish",
      "notes_notes_page": "Dragonfish",
      "notes": "Dragonfish; Dragonfish"
    },
    {
      "net_number": "1",
      "time_open_local": null,
      "time_close_local": "15:23",
      "time_close_gmt": "22:22",
      "target_depth_m": "1000-800",
      "depth_max_m": "1000.3",
      "depth_min_m": "800.0",
      "depth_m": null,
      "lat": null,
      "lon": null,
      "angle": "54.2",
      "flow_counts": "480",
      "volume_filtered": "1591.9",
      "mwo_net": null,
      "winch_speed": "0,5,7,10",
      "notes_table": "cyclothone",
      "notes_notes_page": "cyclothone",
      "notes": "cyclothone; cyclothone"
    },
    {
      "net_number": "2",
      "time_open_local": null,
      "time_close_local": "16:03",
      "time_close_gmt": "23:03",
      "target_depth_m": "800-500",
      "depth_max_m": "800.0",
      "depth_min_m": "499.8",
      "depth_m": null,
      "lat": null,
      "lon": null,
      "angle": "60.7",
      "flow_counts": "619",
      "volume_filtered": "1770.2",
      "mwo_net": null,
      "winch_speed": "10,12,15",
      "notes_table": "(1942. PAR 22:54)",
      "notes_notes_page": "myctophid, shrimp, copepods",
      "notes": "(1942. PAR 22:54); myctophid, shrimp, copepods"
    },
    {
      "net_number": "3",
      "time_open_local": null,
      "time_close_local": "16:29",
      "time_close_gmt": "23:29",
      "target_depth_m": "500-350",
      "depth_max_m": "449.8",
      "depth_min_m": "349.6",
      "depth_m": null,
      "lat": null,
      "lon": null,
      "angle": "57.9",
      "flow_counts": "405",
      "volume_filtered": "1293.2",
      "mwo_net": null,
      "winch_speed": "15",
      "notes_table": "1947.1 PAR 23:20",
      "notes_notes_page": "myctophid, lophogastrid BARELY any copepods",
      "notes": "1947.1 PAR 23:20; myctophid, lophogastrid BARELY any copepods"
    },
    {
      "net_number": "4",
      "time_open_local": null,
      "time_close_local": "16:34",
      "time_close_gmt": "23:34",
      "target_depth_m": "350-300",
      "depth_max_m": "349.6",
      "depth_min_m": "299.6",
      "depth_m": null,
      "lat": null,
      "lon": null,
      "angle": "56.3",
      "flow_counts": "84",
      "volume_filtered": "258.6",
      "mwo_net": null,
      "winch_speed": "15",
      "notes_table": "1598.6 PAR",
      "notes_notes_page": "myctophids, krill, copepods",
      "notes": "1598.6 PAR; myctophids, krill, copepods"
    },
    {
      "net_number": "5",
      "time_open_local": null,
      "time_close_local": "16:40",
      "time_close_gmt": "23:40",
      "target_depth_m": "300-250",
      "depth_max_m": "299.6",
      "depth_min_m": "250.1",
      "depth_m": null,
      "lat": null,
      "lon": null,
      "angle": "58",
      "flow_counts": "96",
      "volume_filtered": "268.6",
      "mwo_net": null,
      "winch_speed": "15",
      "notes_table": "1515.2 PAR",
      "notes_notes_page": "clio pyramidata, ostracods, copepods",
      "notes": "1515.2 PAR; clio pyramidata, ostracods, copepods"
    },
    {
      "net_number": "6",
      "time_open_local": null,
      "time_close_local": "16:53",
      "time_close_gmt": "23:53",
      "target_depth_m": "250-150",
      "depth_max_m": "250.1",
      "depth_min_m": "150.4",
      "depth_m": null,
      "lat": null,
      "lon": null,
      "angle": "59.3",
      "flow_counts": "211",
      "volume_filtered": "650.0",
      "mwo_net": null,
      "winch_speed": "15",
      "notes_table": "salp, ostracod city, ichthy, ctenophore, clio pyramidata, siphonophore bracts",
      "notes_notes_page": "salp, ostracod city, ichthy, ctenophore, clio pyramidata, siphonophore bracts",
      "notes": "salp, ostracod city, ichthy, ctenophore, clio pyramidata, siphonophore bracts; salp, ostracod city, ichthy, ctenophore, clio pyramidata, siphonophore bracts"
    },
    {
      "net_number": "7",
      "time_open_local": null,
      "time_close_local": "16:58",
      "time_close_gmt": "23:58",
      "target_depth_m": "150-110",
      "depth_max_m": "150.4",
      "depth_min_m": "110.0",
      "depth_m": null,
      "lat": null,
      "lon": null,
      "angle": "59.8",
      "flow_counts": "76",
      "volume_filtered": "227.3",
      "mwo_net": null,
      "winch_speed": "15",
      "notes_table": "1223.5 PAR",
      "notes_notes_page": "NO 5000 almost nothing but tiny copepods",
      "notes": "1223.5 PAR; NO 5000 almost nothing but tiny copepods"
    },
    {
      "net_number": "8",
      "time_open_local": null,
      "time_close_local": "17:06",
      "time_close_gmt": "00:06",
      "target_depth_m": "110-50",
      "depth_max_m": "110.0",
      "depth_min_m": "49.2",
      "depth_m": null,
      "lat": null,
      "lon": null,
      "angle": "59.0",
      "flow_counts": "138",
      "volume_filtered": "413.5",
      "mwo_net": null,
      "winch_speed": "15",
      "notes_table": "980.9 PAR",
      "notes_notes_page": "ctenophores, hyalocylis, diacria (all the pterop) kill furcilia",
      "notes": "980.9 PAR; ctenophores, hyalocylis, diacria (all the pterop) kill furcilia"
    },
    {
      "net_number": "9",
      "time_open_local": null,
      "time_close_local": "17:13",
      "time_close_gmt": "00:13",
      "target_depth_m": "50-0",
      "depth_max_m": "49.2",
      "depth_min_m": "0",
      "depth_m": null,
      "lat": null,
      "lon": null,
      "angle": "13.3",
      "flow_counts": "118",
      "volume_filtered": "469.6",
      "mwo_net": null,
      "winch_speed": "15",
      "notes_table": "811.2",
      "notes_notes_page": null,
      "notes": "811.2"
    }
  ],
  "quality": {
    "field_confidence": {
      "header.cruise": 1.0,
      "header.tow_moc_number": 1.0,
      "header.file_name": 1.0,
      "header.date": 1.0,
      "header.local_date": 1.0,
      "header.gmt_date": 1.0,
      "header.date_unresolved": 1.0,
      "header.date_unresolved_reason": 1.0,
      "header.location": 1.0,
      "header.day_night": 1.0,
      "header.direction": 1.0,
      "header.sea_state": 0.95,
      "header.wind_speed": 1.0,
      "header.local_time_from": 1.0,
      "header.local_time_to": 0.0,
      "header.gmt_time_from": 1.0,
      "header.gmt_time_to": 0.0,
      "header.net_condition": 1.0,
      "header.net_mesh": 1.0,
      "header.net_size": 1.0,
      "header.net_type": 1.0,
      "header.sog": 1.0,
      "header.operator": 1.0,
      "header.start_lat": 1.0,
      "header.start_long": 1.0,
      "header.end_lat": 0.0,
      "header.end_long": 0.0,
      "form_comments": 1.0
    },
    "uncertain_fields": [
      "header.sea_state",
      "header.local_time_to",
      "header.gmt_time_to",
      "header.end_lat",
      "header.end_long"
    ],
    "notes": [
      "Sea state handwriting is slightly unclear but interpreted as 'small waves'.",
      "No explicit 'to' times for local or GMT time in header.",
      "End Lat/Long not filled in.",
      "Net notes page: net 9 has no notes."
    ]
  }
}