{
  "schema_version": "2.0",
  "tow_id": "28",
  "header": {
    "cruise": "SIL 25 28",
    "tow_moc_number": "8",
    "file_name": null,
    "date": null,
    "local_date": "2023-12-24",
    "gmt_date": "2023-12-25",
    "date_unresolved": true,
    "date_unresolved_reason": "Local Date (12-24-2023) and GMT Date (12-25-2023) differ.",
    "location": "SOUTH PAS",
    "day_night": "D",
    "direction": "303",
    "sea_state": "FLAT",
    "wind_speed": "7.41",
    "local_time_from": "13:20",
    "local_time_to": "15:30",
    "gmt_time_from": "20:20",
    "gmt_time_to": "22:30",
    "net_condition": "GOOD",
    "net_mesh": "200 um",
    "net_size": "1 m2",
    "net_type": "FINE SCALE",
    "sog": "1.5-1.8-2.0",
    "operator": null,
    "start_lat": "28 44.4N",
    "start_long": "11 30.24W",
    "end_lat": "28 30.49N",
    "end_long": "11 32.96W"
  },
  "form_comments": "SPEED IS VARIABLE SHIFTS BETWEEN 1.8 AND 2.2",
  "net_tows": [
    {
      "net_number": "0",
      "time_open_local": "13:20",
      "time_close_local": "13:55",
      "time_close_gmt": null,
      "target_depth_m": null,
      "depth_max_m": "421.7",
      "depth_min_m": "213",
      "depth_m": null,
      "lat": null,
      "lon": null,
      "angle": "107",
      "flow_counts": "3105",
      "volume_filtered": null,
      "mwo_net": null,
      "winch_speed": null,
      "notes_table": null,
      "notes_notes_page": null,
      "notes": null
    },
    {
      "net_number": "1",
      "time_open_local": "13:55",
      "time_close_local": "14:05",
      "time_close_gmt": null,
      "target_depth_m": null,
      "depth_max_m": "421.7",
      "depth_min_m": "372.2",
      "depth_m": null,
      "lat": null,
      "lon": null,
      "angle": "289",
      "flow_counts": "101",
      "volume_filtered": "283.6",
      "mwo_net": null,
      "winch_speed": null,
      "notes_table": null,
      "notes_notes_page": null,
      "notes": null
    },
    {
      "net_number": "2",
      "time_open_local": "14:05",
      "time_close_local": "14:12",
      "time_close_gmt": null,
      "target_depth_m": null,
      "depth_max_m": "372.2",
      "depth_min_m": "347.5",
      "depth_m": null,
      "lat": null,
      "lon": null,
      "angle": "34",
      "flow_counts": "34",
      "volume_filtered": "90.5",
      "mwo_net": null,
      "winch_speed": null,
      "notes_table": "CHANGED SPEED",
      "notes_notes_page": null,
      "notes": "CHANGED SPEED"
    },
    {
      "net_number": "3",
      "time_open_local": "14:12",
      "time_close_local": "14:31",
      "time_close_gmt": null,
      "target_depth_m": null,
      "depth_max_m": "347.5",
      "depth_min_m": "323.3",
      "depth_m": null,
      "lat": null,
      "lon": null,
      "angle": "37.7",
      "flow_counts": "36",
      "volume_filtered": "90.8",
      "mwo_net": null,
      "winch_speed": null,
      "notes_table": "TO 2.0",
      "notes_notes_page": null,
      "notes": "TO 2.0"
    },
    {
      "net_number": "4",
      "time_open_local": "14:31",
      "time_close_local": "14:52",
      "time_close_gmt": null,
      "target_depth_m": null,
      "depth_max_m": "323.3",
      "depth_min_m": "274",
      "depth_m": null,
      "lat": null,
      "lon": null,
      "angle": "305",
      "flow_counts": "305",
      "volume_filtered": "512.8",
      "mwo_net": null,
      "winch_speed": null,
      "notes_table": "CHANGED TO 1.8 IT WORKED!",
      "notes_notes_page": null,
      "notes": "CHANGED TO 1.8 IT WORKED!"
    },
    {
      "net_number": "5",
      "time_open_local": "14:52",
      "time_close_local": "15:21",
      "time_close_gmt": null,
      "target_depth_m": null,
      "depth_max_m": "274",
      "depth_min_m": "250.4",
      "depth_m": null,
      "lat": null,
      "lon": null,
      "angle": "406",
      "flow_counts": "77",
      "volume_filtered": "198.8",
      "mwo_net": null,
      "winch_speed": null,
      "notes_table": null,
      "notes_notes_page": null,
      "notes": null
    },
    {
      "net_number": "6",
      "time_open_local": "15:21",
      "time_close_local": "15:30",
      "time_close_gmt": null,
      "target_depth_m": null,
      "depth_max_m": "250.4",
      "depth_min_m": "225.3",
      "depth_m": null,
      "lat": null,
      "lon": null,
      "angle": "92",
      "flow_counts": "232.4",
      "volume_filtered": null,
      "mwo_net": null,
      "winch_speed": null,
      "notes_table": null,
      "notes_notes_page": null,
      "notes": null
    },
    {
      "net_number": "7",
      "time_open_local": "15:30",
      "time_close_local": "15:50",
      "time_close_gmt": null,
      "target_depth_m": null,
      "depth_max_m": "225.2",
      "depth_min_m": "200.4",
      "depth_m": null,
      "lat": null,
      "lon": null,
      "angle": "357",
      "flow_counts": "102",
      "volume_filtered": "267.2",
      "mwo_net": null,
      "winch_speed": null,
      "notes_table": null,
      "notes_notes_page": null,
      "notes": null
    },
    {
      "net_number": "8",
      "time_open_local": "15:50",
      "time_close_local": "16:02",
      "time_close_gmt": null,
      "target_depth_m": null,
      "depth_max_m": "200.1",
      "depth_min_m": "125.5",
      "depth_m": null,
      "lat": null,
      "lon": null,
      "angle": "124",
      "flow_counts": "324.7",
      "volume_filtered": null,
      "mwo_net": null,
      "winch_speed": null,
      "notes_table": null,
      "notes_notes_page": null,
      "notes": null
    },
    {
      "net_number": "9",
      "time_open_local": "16:15",
      "time_close_local": "16:30",
      "time_close_gmt": null,
      "target_depth_m": null,
      "depth_max_m": "125.5",
      "depth_min_m": "0",
      "depth_m": null,
      "lat": null,
      "lon": null,
      "angle": "172",
      "flow_counts": "41MS",
      "volume_filtered": null,
      "mwo_net": null,
      "winch_speed": null,
      "notes_table": null,
      "notes_notes_page": null,
      "notes": null
    }
  ],
  "quality": {
    "field_confidence": {
      "header.cruise": 0.95,
      "header.tow_moc_number": 0.95,
      "header.file_name": 0.0,
      "header.date": 0.0,
      "header.local_date": 0.95,
      "header.gmt_date": 0.95,
      "header.date_unresolved": 1.0,
      "header.date_unresolved_reason": 1.0,
      "header.location": 0.95,
      "header.day_night": 0.95,
      "header.direction": 0.95,
      "header.sea_state": 0.95,
      "header.wind_speed": 0.95,
      "header.local_time_from": 0.95,
      "header.local_time_to": 0.95,
      "header.gmt_time_from": 0.95,
      "header.gmt_time_to": 0.95,
      "header.net_condition": 0.95,
      "header.net_mesh": 0.95,
      "header.net_size": 0.95,
      "header.net_type": 0.95,
      "header.sog": 0.9,
      "header.operator": 0.0,
      "header.start_lat": 0.95,
      "header.start_long": 0.95,
      "header.end_lat": 0.95,
      "header.end_long": 0.95,
      "form_comments": 0.9,
      "net_tows[0].net_number": 1.0,
      "net_tows[0].time_open_local": 0.95,
      "net_tows[0].time_close_local": 0.95,
      "net_tows[0].time_close_gmt": 0.0,
      "net_tows[0].target_depth_m": 0.0,
      "net_tows[0].depth_max_m": 0.95,
      "net_tows[0].depth_min_m": 0.95,
      "net_tows[0].depth_m": 0.0,
      "net_tows[0].lat": 0.0,
      "net_tows[0].lon": 0.0,
      "net_tows[0].angle": 0.9,
      "net_tows[0].flow_counts": 0.9,
      "net_tows[0].volume_filtered": 0.0,
      "net_tows[0].mwo_net": 0.0,
      "net_tows[0].winch_speed": 0.0,
      "net_tows[0].notes_table": 0.0,
      "net_tows[0].notes_notes_page": 0.0,
      "net_tows[0].notes": 0.0
    },
    "uncertain_fields": [
      "header.file_name",
      "header.operator",
      "header.date",
      "net_tows[0].volume_filtered",
      "net_tows[0].mwo_net",
      "net_tows[0].winch_speed",
      "net_tows[0].notes_table",
      "net_tows[0].notes_notes_page",
      "net_tows[0].notes"
    ],
    "notes": [
      "Date fields (local and GMT) differ; date_unresolved set with reason.",
      "No file name or operator fields present.",
      "No depth_m column; depth_m set to null for all rows.",
      "Some net rows have ambiguous or missing values for volume filtered, mwo net, winch speed, and notes."
    ]
  }
}