{
  "schema_version": "2.0",
  "tow_id": "7",
  "header": {
    "cruise": "SR2528",
    "tow_moc_number": "7",
    "file_name": "SECRET",
    "date": null,
    "local_date": "12-23-2025",
    "gmt_date": "12-24-2025",
    "date_unresolved": true,
    "date_unresolved_reason": "Local Date (12-23-2025) and GMT Date (12-24-2025) differ.",
    "location": "QUAY HILLS",
    "day_night": "N",
    "direction": "300",
    "sea_state": "FLAT",
    "wind_speed": "10.9",
    "local_time_from": "20:30",
    "local_time_to": "23:32",
    "gmt_time_from": "03:30",
    "gmt_time_to": "06:32",
    "net_condition": null,
    "net_mesh": "200 um",
    "net_size": "1 m^2",
    "net_type": "HORIZONTAL",
    "sog": "2.0",
    "operator": "BEN M J",
    "start_lat": "27 32 120 N",
    "start_long": "111 29.420",
    "end_lat": null,
    "end_long": null
  },
  "form_comments": "transmissometer_not_working\nEDDY NOT TO EXAM JAR DRAGONFISH",
  "net_tows": [
    {
      "net_number": "0",
      "time_open_local": null,
      "time_close_local": "20:30",
      "time_close_gmt": "03:30",
      "target_depth_m": null,
      "depth_max_m": null,
      "depth_min_m": null,
      "depth_m": null,
      "lat": "27\u00b032.120",
      "lon": "111\u00b029.420",
      "angle": "46.2",
      "flow_counts": "360",
      "volume_filtered": "824.6",
      "mwo_net": null,
      "winch_speed": null,
      "notes_table": null,
      "notes_notes_page": null,
      "notes": null
    },
    {
      "net_number": "1",
      "time_open_local": null,
      "time_close_local": "21:40",
      "time_close_gmt": "04:10",
      "target_depth_m": null,
      "depth_max_m": null,
      "depth_min_m": null,
      "depth_m": null,
      "lat": "27\u00b035.861",
      "lon": "111\u00b035.461",
      "angle": "48.8",
      "flow_counts": "483",
      "volume_filtered": "288.3",
      "mwo_net": null,
      "winch_speed": null,
      "notes_table": null,
      "notes_notes_page": null,
      "notes": null
    },
    {
      "net_number": "2",
      "time_open_local": null,
      "time_close_local": "21:42",
      "time_close_gmt": "04:12",
      "target_depth_m": null,
      "depth_max_m": null,
      "depth_min_m": null,
      "depth_m": null,
      "lat": "27\u00b035.911",
      "lon": "111\u00b025.461",
      "angle": "48.5",
      "flow_counts": "372",
      "volume_filtered": "428.6",
      "mwo_net": null,
      "winch_speed": null,
      "notes_table": null,
      "notes_notes_page": null,
      "notes": null
    },
    {
      "net_number": "3",
      "time_open_local": null,
      "time_close_local": "21:42",
      "time_close_gmt": "04:42",
      "target_depth_m": null,
      "depth_max_m": null,
      "depth_min_m": null,
      "depth_m": null,
      "lat": "27\u00b031.594",
      "lon": "111\u00b036.015",
      "angle": "48.5",
      "flow_counts": "372",
      "volume_filtered": "835.5",
      "mwo_net": null,
      "winch_speed": null,
      "notes_table": null,
      "notes_notes_page": null,
      "notes": null
    },
    {
      "net_number": "4",
      "time_open_local": null,
      "time_close_local": "22:00",
      "time_close_gmt": "05:00",
      "target_depth_m": null,
      "depth_max_m": null,
      "depth_min_m": null,
      "depth_m": null,
      "lat": "27\u00b031.457",
      "lon": "111\u00b035.976",
      "angle": "48.6",
      "flow_counts": "94",
      "volume_filtered": "2144.1",
      "mwo_net": null,
      "winch_speed": null,
      "notes_table": null,
      "notes_notes_page": null,
      "notes": null
    },
    {
      "net_number": "5",
      "time_open_local": null,
      "time_close_local": "22:32",
      "time_close_gmt": "05:32",
      "target_depth_m": null,
      "depth_max_m": null,
      "depth_min_m": null,
      "depth_m": null,
      "lat": "27\u00b035.773",
      "lon": "111\u00b037.379",
      "angle": "47.5",
      "flow_counts": "85",
      "volume_filtered": "495.6",
      "mwo_net": null,
      "winch_speed": null,
      "notes_table": null,
      "notes_notes_page": null,
      "notes": null
    },
    {
      "net_number": "6",
      "time_open_local": null,
      "time_close_local": "22:36",
      "time_close_gmt": "05:38",
      "target_depth_m": null,
      "depth_max_m": null,
      "depth_min_m": null,
      "depth_m": null,
      "lat": "27\u00b035.894",
      "lon": "111\u00b032.468",
      "angle": "46.7",
      "flow_counts": "194",
      "volume_filtered": "445.7",
      "mwo_net": null,
      "winch_speed": null,
      "notes_table": null,
      "notes_notes_page": null,
      "notes": null
    },
    {
      "net_number": "7",
      "time_open_local": null,
      "time_close_local": "02:59",
      "time_close_gmt": "05:59",
      "target_depth_m": null,
      "depth_max_m": null,
      "depth_min_m": null,
      "depth_m": null,
      "lat": "27\u00b036.344",
      "lon": "111\u00b036.036",
      "angle": "45.9",
      "flow_counts": "116",
      "volume_filtered": "274.4",
      "mwo_net": null,
      "winch_speed": null,
      "notes_table": null,
      "notes_notes_page": null,
      "notes": null
    },
    {
      "net_number": "8",
      "time_open_local": null,
      "time_close_local": "03:10",
      "time_close_gmt": "06:10",
      "target_depth_m": null,
      "depth_max_m": null,
      "depth_min_m": null,
      "depth_m": null,
      "lat": "27\u00b032.366",
      "lon": "111\u00b033.414",
      "angle": "48.1",
      "flow_counts": "215",
      "volume_filtered": "492",
      "mwo_net": null,
      "winch_speed": null,
      "notes_table": null,
      "notes_notes_page": null,
      "notes": null
    },
    {
      "net_number": "9",
      "time_open_local": null,
      "time_close_local": "23:32",
      "time_close_gmt": "06:32",
      "target_depth_m": null,
      "depth_max_m": null,
      "depth_min_m": null,
      "depth_m": null,
      "lat": "27\u00b034.204",
      "lon": "111\u00b036.165",
      "angle": null,
      "flow_counts": null,
      "volume_filtered": null,
      "mwo_net": null,
      "winch_speed": null,
      "notes_table": "NET LEFT OPEN WIRE STOPPED GO OFF",
      "notes_notes_page": null,
      "notes": "NET LEFT OPEN WIRE STOPPED GO OFF"
    }
  ],
  "quality": {
    "field_confidence": {
      "header.cruise": 1.0,
      "header.tow_moc_number": 1.0,
      "header.file_name": 0.9,
      "header.date": 1.0,
      "header.local_date": 1.0,
      "header.gmt_date": 1.0,
      "header.date_unresolved": 1.0,
      "header.date_unresolved_reason": 1.0,
      "header.location": 0.9,
      "header.day_night": 1.0,
      "header.direction": 1.0,
      "header.sea_state": 1.0,
      "header.wind_speed": 1.0,
      "header.local_time_from": 1.0,
      "header.local_time_to": 0.95,
      "header.gmt_time_from": 1.0,
      "header.gmt_time_to": 0.95,
      "header.net_condition": 0.8,
      "header.net_mesh": 1.0,
      "header.net_size": 1.0,
      "header.net_type": 1.0,
      "header.sog": 1.0,
      "header.operator": 0.95,
      "header.start_lat": 0.95,
      "header.start_long": 0.95,
      "header.end_lat": 0.7,
      "header.end_long": 0.7,
      "form_comments": 1.0,
      "net_tows[0].net_number": 1.0,
      "net_tows[0].time_close_local": 1.0,
      "net_tows[0].time_close_gmt": 1.0,
      "net_tows[0].lat": 0.95,
      "net_tows[0].lon": 0.95,
      "net_tows[0].angle": 1.0,
      "net_tows[0].flow_counts": 1.0,
      "net_tows[0].volume_filtered": 1.0,
      "net_tows[9].notes_table": 1.0
    },
    "uncertain_fields": [
      "header.end_lat",
      "header.end_long"
    ],
    "notes": [
      "End Lat/Long not filled on form; only Start Lat/Long present.",
      "Net open times not present; only close times given.",
      "Net 9 has a note in the table: 'NET LEFT OPEN WIRE STOPPED GO OFF'."
    ]
  }
}