{
  "schema_version": "2.0",
  "tow_id": "04",
  "header": {
    "cruise": "SR 2328",
    "tow_moc_number": "04",
    "file_name": "8E1EEL-4",
    "date": null,
    "local_date": null,
    "gmt_date": null,
    "date_unresolved": true,
    "date_unresolved_reason": "Two dates written: 'DEC. 20, 2023' and 'DEC. 21', unclear which is correct or which time zone each refers to.",
    "location": "GUAYMAS",
    "day_night": "N",
    "direction": "248.9",
    "sea_state": "Flat",
    "wind_speed": "7.4",
    "local_time_from": "19:20",
    "local_time_to": "23:15",
    "gmt_time_from": "02:20",
    "gmt_time_to": "06:15",
    "net_condition": "Good",
    "net_mesh": "200 um",
    "net_size": "1 m2",
    "net_type": null,
    "sog": "2",
    "operator": null,
    "start_lat": "N 27\u00b023.66856",
    "start_long": "W 111\u00b021.34556",
    "end_lat": "N 27\u00b031.60450",
    "end_long": "W 111\u00b025.06630"
  },
  "form_comments": "TRANSMISSIOMETER NOT WORKING",
  "net_tows": [
    {
      "net_number": "0",
      "time_open_local": null,
      "time_close_local": "20:53",
      "time_close_gmt": null,
      "target_depth_m": "0-1000",
      "depth_max_m": "0",
      "depth_min_m": "987.7",
      "depth_m": null,
      "lat": null,
      "lon": null,
      "angle": "46.2",
      "flow_counts": "634",
      "volume_filtered": "1406.5",
      "mwo_net": null,
      "winch_speed": "20",
      "notes_table": null,
      "notes_notes_page": null,
      "notes": null
    },
    {
      "net_number": "1",
      "time_open_local": null,
      "time_close_local": "21:13",
      "time_close_gmt": null,
      "target_depth_m": "1000-800",
      "depth_max_m": "997.7",
      "depth_min_m": "903.3",
      "depth_m": null,
      "lat": null,
      "lon": null,
      "angle": "54.7",
      "flow_counts": "243",
      "volume_filtered": "489.5",
      "mwo_net": null,
      "winch_speed": "7",
      "notes_table": null,
      "notes_notes_page": null,
      "notes": null
    },
    {
      "net_number": "2",
      "time_open_local": null,
      "time_close_local": "21:21",
      "time_close_gmt": null,
      "target_depth_m": "900-500",
      "depth_max_m": "903.3",
      "depth_min_m": "500.1",
      "depth_m": null,
      "lat": null,
      "lon": null,
      "angle": "44.2",
      "flow_counts": "682",
      "volume_filtered": "1602.8",
      "mwo_net": null,
      "winch_speed": "12",
      "notes_table": null,
      "notes_notes_page": null,
      "notes": null
    },
    {
      "net_number": "3",
      "time_open_local": null,
      "time_close_local": "21:28",
      "time_close_gmt": null,
      "target_depth_m": "500-400",
      "depth_max_m": "500.1",
      "depth_min_m": "392.8",
      "depth_m": null,
      "lat": null,
      "lon": null,
      "angle": "41.0",
      "flow_counts": "163",
      "volume_filtered": "405.3",
      "mwo_net": null,
      "winch_speed": "12/14",
      "notes_table": null,
      "notes_notes_page": null,
      "notes": null
    },
    {
      "net_number": "4",
      "time_open_local": null,
      "time_close_local": "21:35",
      "time_close_gmt": null,
      "target_depth_m": "400-325",
      "depth_max_m": "392.8",
      "depth_min_m": "324.7",
      "depth_m": null,
      "lat": null,
      "lon": null,
      "angle": "37.4",
      "flow_counts": "74",
      "volume_filtered": "190.5",
      "mwo_net": null,
      "winch_speed": "14",
      "notes_table": null,
      "notes_notes_page": null,
      "notes": null
    },
    {
      "net_number": "5",
      "time_open_local": null,
      "time_close_local": "21:44",
      "time_close_gmt": null,
      "target_depth_m": "325-225",
      "depth_max_m": "324.7",
      "depth_min_m": "224.7",
      "depth_m": null,
      "lat": null,
      "lon": null,
      "angle": "40.8",
      "flow_counts": "104",
      "volume_filtered": "261.6",
      "mwo_net": null,
      "winch_speed": "14/13",
      "notes_table": null,
      "notes_notes_page": null,
      "notes": null
    },
    {
      "net_number": "6",
      "time_open_local": null,
      "time_close_local": "21:53",
      "time_close_gmt": null,
      "target_depth_m": "225-150",
      "depth_max_m": "224.7",
      "depth_min_m": "150.2",
      "depth_m": null,
      "lat": null,
      "lon": null,
      "angle": "41.2",
      "flow_counts": "87",
      "volume_filtered": "206.4",
      "mwo_net": null,
      "winch_speed": "11",
      "notes_table": null,
      "notes_notes_page": null,
      "notes": null
    },
    {
      "net_number": "7",
      "time_open_local": null,
      "time_close_local": "21:59",
      "time_close_gmt": null,
      "target_depth_m": "150-110",
      "depth_max_m": "150.2",
      "depth_min_m": "108.9",
      "depth_m": null,
      "lat": null,
      "lon": null,
      "angle": "46.7",
      "flow_counts": "55",
      "volume_filtered": "128.8",
      "mwo_net": null,
      "winch_speed": "11",
      "notes_table": null,
      "notes_notes_page": null,
      "notes": null
    },
    {
      "net_number": "8",
      "time_open_local": null,
      "time_close_local": "23:04",
      "time_close_gmt": null,
      "target_depth_m": "110-70",
      "depth_max_m": "108.9",
      "depth_min_m": "70.3",
      "depth_m": null,
      "lat": null,
      "lon": null,
      "angle": "46.9",
      "flow_counts": "63",
      "volume_filtered": "145.5",
      "mwo_net": null,
      "winch_speed": "11",
      "notes_table": null,
      "notes_notes_page": null,
      "notes": null
    },
    {
      "net_number": "9",
      "time_open_local": null,
      "time_close_local": "23:15",
      "time_close_gmt": null,
      "target_depth_m": "70-0",
      "depth_max_m": "70.3",
      "depth_min_m": "-0.2",
      "depth_m": null,
      "lat": null,
      "lon": null,
      "angle": "19.4",
      "flow_counts": "116",
      "volume_filtered": "276.4",
      "mwo_net": null,
      "winch_speed": "11",
      "notes_table": null,
      "notes_notes_page": null,
      "notes": null
    }
  ],
  "quality": {
    "field_confidence": {
      "header.cruise": 0.98,
      "header.tow_moc_number": 1.0,
      "header.file_name": 0.95,
      "header.date": 0.3,
      "header.local_date": 0.3,
      "header.gmt_date": 0.3,
      "header.date_unresolved": 1.0,
      "header.date_unresolved_reason": 1.0,
      "header.location": 1.0,
      "header.day_night": 1.0,
      "header.direction": 1.0,
      "header.sea_state": 0.95,
      "header.wind_speed": 1.0,
      "header.local_time_from": 1.0,
      "header.local_time_to": 1.0,
      "header.gmt_time_from": 1.0,
      "header.gmt_time_to": 1.0,
      "header.net_condition": 0.95,
      "header.net_mesh": 0.95,
      "header.net_size": 0.95,
      "header.net_type": 0.0,
      "header.sog": 1.0,
      "header.operator": 0.0,
      "header.start_lat": 0.98,
      "header.start_long": 0.98,
      "header.end_lat": 0.98,
      "header.end_long": 0.98,
      "form_comments": 0.9,
      "net_tows[0].net_number": 1.0,
      "net_tows[0].time_close_local": 1.0,
      "net_tows[0].target_depth_m": 1.0,
      "net_tows[0].depth_max_m": 1.0,
      "net_tows[0].depth_min_m": 1.0,
      "net_tows[0].angle": 1.0,
      "net_tows[0].flow_counts": 1.0,
      "net_tows[0].volume_filtered": 1.0,
      "net_tows[0].winch_speed": 1.0
    },
    "uncertain_fields": [
      "header.date",
      "header.local_date",
      "header.gmt_date",
      "header.file_name",
      "header.sea_state",
      "header.net_condition",
      "header.net_mesh",
      "header.net_size"
    ],
    "notes": [
      "Date field contains two different dates; unable to resolve which is correct.",
      "No explicit 'Depth (m)' column; depth_m set to null for all rows.",
      "No net_type or operator fields present on form.",
      "Some winch_speed cells contain two values separated by a slash; row-level mapping ambiguous, so time fields set to null where applicable."
    ]
  }
}