{
  "schema_version": "2.0",
  "tow_id": "16",
  "header": {
    "cruise": "SR2529",
    "tow_moc_number": "16",
    "file_name": "Seibel_16",
    "date": "01-05-'26",
    "local_date": "01-05-'26",
    "gmt_date": "01-05-'26",
    "date_unresolved": false,
    "date_unresolved_reason": null,
    "location": "Carmen",
    "day_night": "Day",
    "direction": "359.2",
    "sea_state": "flat",
    "wind_speed": "11.4",
    "local_time_from": "11:44",
    "local_time_to": null,
    "gmt_time_from": "18:41",
    "gmt_time_to": null,
    "net_condition": null,
    "net_mesh": "200um",
    "net_size": "1m2",
    "net_type": "HORIZONTAL",
    "sog": "2",
    "operator": "Amy",
    "start_lat": "26\u00b017.940'064",
    "start_long": "110\u00b031.895'85",
    "end_lat": null,
    "end_long": null
  },
  "form_comments": null,
  "net_tows": [
    {
      "net_number": "0",
      "time_open_local": null,
      "time_close_local": "12:18",
      "time_close_gmt": "19:18",
      "target_depth_m": null,
      "depth_max_m": null,
      "depth_min_m": null,
      "depth_m": "250.0",
      "lat": "26\u00b032.335",
      "lon": "110\u00b031.895",
      "angle": "50.7",
      "flow_counts": "448",
      "volume_filtered": "1428.4",
      "mwo_net": null,
      "winch_speed": "20., 2",
      "notes_table": "0.25",
      "notes_notes_page": "ostracods, 1 squid, clio pyramidata",
      "notes": "0.25; ostracods, 1 squid, clio pyramidata"
    },
    {
      "net_number": "1",
      "time_open_local": null,
      "time_close_local": "12:48",
      "time_close_gmt": "19:48",
      "target_depth_m": null,
      "depth_max_m": null,
      "depth_min_m": null,
      "depth_m": "248.8",
      "lat": "26\u00b019.623",
      "lon": "110\u00b032.97",
      "angle": "52.2",
      "flow_counts": "334",
      "volume_filtered": "1141.4",
      "mwo_net": "all n/a",
      "winch_speed": "6.25, 0.28",
      "notes_table": "2 squid, ostracods, clio pyramidata, myctophids",
      "notes_notes_page": "2 squid, ostracods, clio pyramidata, myctophids",
      "notes": "2 squid, ostracods, clio pyramidata, myctophids; 2 squid, ostracods, clio pyramidata, myctophids"
    },
    {
      "net_number": "2",
      "time_open_local": null,
      "time_close_local": "13:00",
      "time_close_gmt": "20:00",
      "target_depth_m": null,
      "depth_max_m": null,
      "depth_min_m": null,
      "depth_m": "250.8",
      "lat": "26\u00b019.803",
      "lon": "110\u00b033.29",
      "angle": "55.0",
      "flow_counts": "138",
      "volume_filtered": "444.9",
      "mwo_net": null,
      "winch_speed": null,
      "notes_table": "0.25 0.172 0.23",
      "notes_notes_page": "ostracod, salp, pteropod, some myctophids, Leuroglossus stilbius y Triphoturus mexicanus, tiny pleuroncode",
      "notes": "0.25 0.172 0.23; ostracod, salp, pteropod, some myctophids, Leuroglossus stilbius y Triphoturus mexicanus, tiny pleuroncode"
    },
    {
      "net_number": "3",
      "time_open_local": null,
      "time_close_local": "13:45",
      "time_close_gmt": "20:45",
      "target_depth_m": null,
      "depth_max_m": null,
      "depth_min_m": null,
      "depth_m": "250.7",
      "lat": "26\u00b021.000",
      "lon": "110\u00b033.251",
      "angle": "50.6",
      "flow_counts": "510",
      "volume_filtered": "1481.6",
      "mwo_net": null,
      "winch_speed": null,
      "notes_table": "0.25, 0.14, 0.23, 0.23, 0.21, 0.29, 0.28, 0.20, 0.19",
      "notes_notes_page": "LOTS taking 1/8, ostracods, clio pyramidata, salp, leptocephali, minimal small myctophids",
      "notes": "0.25, 0.14, 0.23, 0.23, 0.21, 0.29, 0.28, 0.20, 0.19; LOTS taking 1/8, ostracods, clio pyramidata, salp, leptocephali, minimal small myctophids"
    },
    {
      "net_number": "4",
      "time_open_local": null,
      "time_close_local": "14:45",
      "time_close_gmt": "21:45",
      "target_depth_m": null,
      "depth_max_m": null,
      "depth_min_m": null,
      "depth_m": "249.7",
      "lat": "26\u00b021.445",
      "lon": "110\u00b035.110",
      "angle": "54.5",
      "flow_counts": "702",
      "volume_filtered": "2284.4",
      "mwo_net": null,
      "winch_speed": null,
      "notes_table": "0.17, 0.15",
      "notes_notes_page": "2 myctophids, ostracods, clio pyramidata, salpa sp.",
      "notes": "0.17, 0.15; 2 myctophids, ostracods, clio pyramidata, salpa sp."
    },
    {
      "net_number": "5",
      "time_open_local": null,
      "time_close_local": "14:54",
      "time_close_gmt": "21:54",
      "target_depth_m": null,
      "depth_max_m": null,
      "depth_min_m": null,
      "depth_m": "249.0",
      "lat": "26\u00b022.638",
      "lon": "110\u00b035.865",
      "angle": "54.9",
      "flow_counts": "78",
      "volume_filtered": "253.6",
      "mwo_net": null,
      "winch_speed": null,
      "notes_table": "pleuroncodes, ostracods, small myctophids, clio pyramidata",
      "notes_notes_page": "pleuroncodes, ostracods, small myctophids, clio pyramidata",
      "notes": "pleuroncodes, ostracods, small myctophids, clio pyramidata; pleuroncodes, ostracods, small myctophids, clio pyramidata"
    },
    {
      "net_number": "6",
      "time_open_local": null,
      "time_close_local": "14:55",
      "time_close_gmt": "21:55",
      "target_depth_m": null,
      "depth_max_m": null,
      "depth_min_m": null,
      "depth_m": "250.3",
      "lat": "26\u00b022.760",
      "lon": "110\u00b035.82",
      "angle": "54.0",
      "flow_counts": "45",
      "volume_filtered": "150.1",
      "mwo_net": null,
      "winch_speed": null,
      "notes_table": "0.14",
      "notes_notes_page": "pleuroncodes, ostracods, small myctophids, clio pyramidata",
      "notes": "0.14; pleuroncodes, ostracods, small myctophids, clio pyramidata"
    },
    {
      "net_number": "7",
      "time_open_local": null,
      "time_close_local": "15:08",
      "time_close_gmt": "22:08",
      "target_depth_m": null,
      "depth_max_m": null,
      "depth_min_m": null,
      "depth_m": "249.5",
      "lat": "26\u00b023.011",
      "lon": "110\u00b036.262",
      "angle": "53.2",
      "flow_counts": "154",
      "volume_filtered": "519.9",
      "mwo_net": null,
      "winch_speed": null,
      "notes_table": "0.14",
      "notes_notes_page": "squid, jelly, salp, ostracod, tiny fish, clio pyramidata",
      "notes": "0.14; squid, jelly, salp, ostracod, tiny fish, clio pyramidata"
    },
    {
      "net_number": "8",
      "time_open_local": null,
      "time_close_local": "15:15",
      "time_close_gmt": "22:15",
      "target_depth_m": null,
      "depth_max_m": null,
      "depth_min_m": null,
      "depth_m": "252.9",
      "lat": "26\u00b023.286",
      "lon": "110\u00b036.488",
      "angle": "51.9",
      "flow_counts": "81",
      "volume_filtered": "278.9",
      "mwo_net": null,
      "winch_speed": null,
      "notes_table": "0.14",
      "notes_notes_page": "clio pyramidata, myctophid, salp, ostracoda",
      "notes": "0.14; clio pyramidata, myctophid, salp, ostracoda"
    },
    {
      "net_number": "9",
      "time_open_local": null,
      "time_close_local": "15:48",
      "time_close_gmt": "22:48",
      "target_depth_m": null,
      "depth_max_m": null,
      "depth_min_m": null,
      "depth_m": "0.3",
      "lat": "26\u00b024.045",
      "lon": "110\u00b037.245",
      "angle": "37.3",
      "flow_counts": "514",
      "volume_filtered": "1724.6",
      "mwo_net": null,
      "winch_speed": null,
      "notes_table": null,
      "notes_notes_page": null,
      "notes": null
    }
  ],
  "quality": {
    "field_confidence": {
      "header.cruise": 1.0,
      "header.tow_moc_number": 1.0,
      "header.file_name": 1.0,
      "header.date": 0.95,
      "header.local_date": 1.0,
      "header.gmt_date": 1.0,
      "header.date_unresolved": 1.0,
      "header.date_unresolved_reason": 1.0,
      "header.location": 1.0,
      "header.day_night": 0.9,
      "header.direction": 1.0,
      "header.sea_state": 1.0,
      "header.wind_speed": 1.0,
      "header.local_time_from": 1.0,
      "header.local_time_to": 0.0,
      "header.gmt_time_from": 1.0,
      "header.gmt_time_to": 0.0,
      "header.net_condition": 0.0,
      "header.net_mesh": 1.0,
      "header.net_size": 1.0,
      "header.net_type": 1.0,
      "header.sog": 1.0,
      "header.operator": 1.0,
      "header.start_lat": 0.95,
      "header.start_long": 0.95,
      "header.end_lat": 0.0,
      "header.end_long": 0.0,
      "form_comments": 1.0,
      "net_tows[0].net_number": 1.0,
      "net_tows[0].time_open_local": 0.0,
      "net_tows[0].time_close_local": 1.0,
      "net_tows[0].time_close_gmt": 1.0,
      "net_tows[0].depth_m": 1.0,
      "net_tows[0].lat": 0.9,
      "net_tows[0].lon": 0.9,
      "net_tows[0].angle": 1.0,
      "net_tows[0].flow_counts": 1.0,
      "net_tows[0].volume_filtered": 1.0,
      "net_tows[0].winch_speed": 0.8,
      "net_tows[0].notes_table": 1.0,
      "net_tows[0].notes_notes_page": 1.0,
      "net_tows[0].notes": 1.0
    },
    "uncertain_fields": [
      "header.day_night",
      "header.start_lat",
      "header.start_long",
      "net_tows[0].lat",
      "net_tows[0].lon"
    ],
    "notes": [
      "Date field uses two-digit year and single quote; assumed as written.",
      "No explicit Depth (m) column; used 'Depth (m)' as present.",
      "Some winch speed values are ambiguous (e.g., '20., 2').",
      "Net 9 has no notes or notes page entry.",
      "Some net notes_table fields contain multiple comma-separated values."
    ]
  }
}