{
  "schema_version": "2.0",
  "tow_id": "10",
  "header": {
    "cruise": "SO 282 B",
    "tow_moc_number": "10",
    "file_name": "sen10_10",
    "date": null,
    "local_date": "12-26-2025",
    "gmt_date": "12-27-2025",
    "date_unresolved": true,
    "date_unresolved_reason": "Local Date and GMT Date differ: Local Date is 12-26-2025, GMT Date is 12-27-2025.",
    "location": "CARMEN",
    "day_night": "N",
    "direction": "152.5",
    "sea_state": "WAVY",
    "wind_speed": "13",
    "local_time_from": "21:00",
    "local_time_to": null,
    "gmt_time_from": null,
    "gmt_time_to": null,
    "net_condition": null,
    "net_mesh": "200um",
    "net_size": "1m\u00b2",
    "net_type": "VERTICAL",
    "sog": "2.0",
    "operator": "SENN/DO",
    "start_lat": "26\u00b033.000",
    "start_long": "100\u00b058.181",
    "end_lat": null,
    "end_long": null
  },
  "form_comments": "FLOW COUNT FROM NET 2 NOT ACCURATE. FC NOT WORKING IN ANY OF THE NETS (FROM NET 2 TO NET 9)",
  "net_tows": [
    {
      "net_number": "0",
      "time_open_local": null,
      "time_close_local": "21:00",
      "time_close_gmt": "04:00",
      "target_depth_m": "0-1000",
      "depth_max_m": "994.7",
      "depth_min_m": "40.8",
      "depth_m": null,
      "lat": null,
      "lon": null,
      "angle": "40.8",
      "flow_counts": "678",
      "volume_filtered": "1271",
      "mwo_net": null,
      "winch_speed": "20",
      "notes_table": null,
      "notes_notes_page": null,
      "notes": null
    },
    {
      "net_number": "1",
      "time_open_local": null,
      "time_close_local": "22:00",
      "time_close_gmt": "05:00",
      "target_depth_m": "1000-800",
      "depth_max_m": "994.7",
      "depth_min_m": "799.8",
      "depth_m": null,
      "lat": null,
      "lon": null,
      "angle": "50.3",
      "flow_counts": "258",
      "volume_filtered": "569.2",
      "mwo_net": null,
      "winch_speed": "7",
      "notes_table": null,
      "notes_notes_page": null,
      "notes": null
    },
    {
      "net_number": "2",
      "time_open_local": null,
      "time_close_local": "22:46",
      "time_close_gmt": "05:46",
      "target_depth_m": "800-500",
      "depth_max_m": "799.8",
      "depth_min_m": "501.2",
      "depth_m": null,
      "lat": null,
      "lon": null,
      "angle": "55.9",
      "flow_counts": "348",
      "volume_filtered": "739.0",
      "mwo_net": null,
      "winch_speed": "7",
      "notes_table": "FLOW COUNT STOPPED.",
      "notes_notes_page": null,
      "notes": "FLOW COUNT STOPPED."
    },
    {
      "net_number": "3",
      "time_open_local": null,
      "time_close_local": "23:10",
      "time_close_gmt": "06:10",
      "target_depth_m": "500-350",
      "depth_max_m": "501.2",
      "depth_min_m": "350.2",
      "depth_m": null,
      "lat": null,
      "lon": null,
      "angle": "48.3",
      "flow_counts": "6.3",
      "volume_filtered": "7",
      "mwo_net": null,
      "winch_speed": "7",
      "notes_table": "NOT WORKING FC",
      "notes_notes_page": null,
      "notes": "NOT WORKING FC"
    },
    {
      "net_number": "4",
      "time_open_local": null,
      "time_close_local": "23:35",
      "time_close_gmt": "06:20",
      "target_depth_m": "350-200",
      "depth_max_m": "350.2",
      "depth_min_m": "201.8",
      "depth_m": null,
      "lat": null,
      "lon": null,
      "angle": "80.8",
      "flow_counts": "0",
      "volume_filtered": "0.0",
      "mwo_net": null,
      "winch_speed": "7",
      "notes_table": "||",
      "notes_notes_page": null,
      "notes": "||"
    },
    {
      "net_number": "5",
      "time_open_local": null,
      "time_close_local": "23:36",
      "time_close_gmt": "06:36",
      "target_depth_m": "200-180",
      "depth_max_m": "201.8",
      "depth_min_m": "244.5",
      "depth_m": null,
      "lat": null,
      "lon": null,
      "angle": "41.5",
      "flow_counts": "2",
      "volume_filtered": "4.8",
      "mwo_net": null,
      "winch_speed": "7",
      "notes_table": "||",
      "notes_notes_page": null,
      "notes": "||"
    },
    {
      "net_number": "6",
      "time_open_local": null,
      "time_close_local": "23:52",
      "time_close_gmt": "06:51",
      "target_depth_m": "180-120",
      "depth_max_m": "244.8",
      "depth_min_m": "148.8",
      "depth_m": null,
      "lat": null,
      "lon": null,
      "angle": "33.7",
      "flow_counts": "4",
      "volume_filtered": "10",
      "mwo_net": null,
      "winch_speed": "7",
      "notes_table": "||",
      "notes_notes_page": null,
      "notes": "||"
    },
    {
      "net_number": "7",
      "time_open_local": null,
      "time_close_local": "23:58",
      "time_close_gmt": "06:58",
      "target_depth_m": "120-110",
      "depth_max_m": "148.8",
      "depth_min_m": "105.5",
      "depth_m": null,
      "lat": null,
      "lon": null,
      "angle": "33.7",
      "flow_counts": "0",
      "volume_filtered": "0.0",
      "mwo_net": null,
      "winch_speed": "7",
      "notes_table": "||",
      "notes_notes_page": null,
      "notes": "||"
    },
    {
      "net_number": "8",
      "time_open_local": null,
      "time_close_local": "00:05",
      "time_close_gmt": "07:05",
      "target_depth_m": "110-50",
      "depth_max_m": "105.5",
      "depth_min_m": "47.7",
      "depth_m": null,
      "lat": null,
      "lon": null,
      "angle": "31.4",
      "flow_counts": "0",
      "volume_filtered": "0.0",
      "mwo_net": null,
      "winch_speed": "7",
      "notes_table": "||",
      "notes_notes_page": null,
      "notes": "||"
    }
  ],
  "quality": {
    "field_confidence": {
      "header.cruise": 0.98,
      "header.tow_moc_number": 1.0,
      "header.file_name": 0.95,
      "header.date": 0.9,
      "header.local_date": 1.0,
      "header.gmt_date": 1.0,
      "header.date_unresolved": 1.0,
      "header.date_unresolved_reason": 1.0,
      "header.location": 0.98,
      "header.day_night": 0.98,
      "header.direction": 0.98,
      "header.sea_state": 0.98,
      "header.wind_speed": 0.98,
      "header.local_time_from": 0.98,
      "header.local_time_to": 0.98,
      "header.gmt_time_from": 0.9,
      "header.gmt_time_to": 0.9,
      "header.net_condition": 0.8,
      "header.net_mesh": 0.98,
      "header.net_size": 0.98,
      "header.net_type": 0.98,
      "header.sog": 0.98,
      "header.operator": 0.98,
      "header.start_lat": 0.98,
      "header.start_long": 0.98,
      "header.end_lat": 0.8,
      "header.end_long": 0.8,
      "form_comments": 0.98,
      "net_tows[0].net_number": 1.0,
      "net_tows[0].time_close_local": 0.98,
      "net_tows[0].time_close_gmt": 0.98,
      "net_tows[0].target_depth_m": 0.98,
      "net_tows[0].depth_max_m": 0.98,
      "net_tows[0].depth_min_m": 0.98,
      "net_tows[0].angle": 0.98,
      "net_tows[0].flow_counts": 0.98,
      "net_tows[0].volume_filtered": 0.98,
      "net_tows[0].winch_speed": 0.98,
      "net_tows[2].notes_table": 0.98,
      "net_tows[3].notes_table": 0.98
    },
    "uncertain_fields": [
      "header.end_lat",
      "header.end_long",
      "header.gmt_time_from",
      "header.gmt_time_to",
      "header.net_condition",
      "net_tows[0].time_open_local",
      "net_tows[1].time_open_local",
      "net_tows[2].time_open_local",
      "net_tows[3].time_open_local",
      "net_tows[4].time_open_local",
      "net_tows[5].time_open_local",
      "net_tows[6].time_open_local",
      "net_tows[7].time_open_local",
      "net_tows[8].time_open_local"
    ],
    "notes": [
      "Date could not be resolved due to mismatch between Local Date and GMT Date.",
      "No explicit time_open_local values present in table.",
      "No end latitude/longitude provided.",
      "Net condition field left blank."
    ]
  }
}