{
  "schema_version": "2.0",
  "tow_id": "34",
  "header": {
    "cruise": null,
    "tow_moc_number": "34",
    "file_name": null,
    "date": "12-28-2025",
    "local_date": null,
    "gmt_date": "12-28-2025",
    "date_unresolved": true,
    "date_unresolved_reason": "Only GMT Date is present; Local Date is absent.",
    "location": null,
    "day_night": null,
    "direction": null,
    "sea_state": null,
    "wind_speed": null,
    "local_time_from": null,
    "local_time_to": null,
    "gmt_time_from": null,
    "gmt_time_to": null,
    "net_condition": null,
    "net_mesh": "200um",
    "net_size": "1m\u00b2",
    "net_type": null,
    "sog": null,
    "operator": null,
    "start_lat": null,
    "start_long": null,
    "end_lat": null,
    "end_long": null
  },
  "form_comments": "transmissometer_not_working",
  "net_tows": [
    {
      "net_number": "0",
      "time_open_local": null,
      "time_close_local": "09:15",
      "time_close_gmt": "16:15",
      "target_depth_m": null,
      "depth_max_m": "70.1",
      "depth_min_m": "0",
      "depth_m": null,
      "lat": null,
      "lon": null,
      "angle": "48.2",
      "flow_counts": "83",
      "volume_filtered": "176.2",
      "mwo_net": null,
      "winch_speed": "20",
      "notes_table": null,
      "notes_notes_page": null,
      "notes": null
    },
    {
      "net_number": "1",
      "time_open_local": null,
      "time_close_local": "09:33",
      "time_close_gmt": "16:33",
      "target_depth_m": null,
      "depth_max_m": "74.1",
      "depth_min_m": "0",
      "depth_m": null,
      "lat": null,
      "lon": null,
      "angle": "48.6",
      "flow_counts": "209",
      "volume_filtered": null,
      "mwo_net": null,
      "winch_speed": null,
      "notes_table": "2320 other FC second",
      "notes_notes_page": null,
      "notes": "2320 other FC second"
    },
    {
      "net_number": "2",
      "time_open_local": null,
      "time_close_local": "09:58",
      "time_close_gmt": "16:58",
      "target_depth_m": null,
      "depth_max_m": "74.1",
      "depth_min_m": "65.8",
      "depth_m": null,
      "lat": null,
      "lon": null,
      "angle": "56.1",
      "flow_counts": null,
      "volume_filtered": null,
      "mwo_net": null,
      "winch_speed": null,
      "notes_table": null,
      "notes_notes_page": null,
      "notes": null
    },
    {
      "net_number": "3",
      "time_open_local": null,
      "time_close_local": "10:08",
      "time_close_gmt": "18:08",
      "target_depth_m": null,
      "depth_max_m": "66.3",
      "depth_min_m": "52.3",
      "depth_m": null,
      "lat": null,
      "lon": null,
      "angle": "35p",
      "flow_counts": "189",
      "volume_filtered": "187",
      "mwo_net": null,
      "winch_speed": null,
      "notes_table": null,
      "notes_notes_page": null,
      "notes": null
    }
  ],
  "quality": {
    "field_confidence": {
      "tow_id": 1.0,
      "header.cruise": 0.0,
      "header.tow_moc_number": 1.0,
      "header.file_name": 0.0,
      "header.date": 0.0,
      "header.local_date": 0.0,
      "header.gmt_date": 0.95,
      "header.date_unresolved": 1.0,
      "header.date_unresolved_reason": 1.0,
      "header.location": 0.0,
      "header.day_night": 0.0,
      "header.direction": 0.0,
      "header.sea_state": 0.0,
      "header.wind_speed": 0.0,
      "header.local_time_from": 0.0,
      "header.local_time_to": 0.0,
      "header.gmt_time_from": 0.0,
      "header.gmt_time_to": 0.0,
      "header.net_condition": 0.0,
      "header.net_mesh": 1.0,
      "header.net_size": 1.0,
      "header.net_type": 0.0,
      "header.sog": 0.0,
      "header.operator": 0.0,
      "header.start_lat": 0.0,
      "header.start_long": 0.0,
      "header.end_lat": 0.0,
      "header.end_long": 0.0,
      "form_comments": 1.0,
      "net_tows[0].net_number": 1.0,
      "net_tows[0].time_open_local": 0.0,
      "net_tows[0].time_close_local": 1.0,
      "net_tows[0].time_close_gmt": 1.0,
      "net_tows[0].target_depth_m": 0.0,
      "net_tows[0].depth_max_m": 1.0,
      "net_tows[0].depth_min_m": 1.0,
      "net_tows[0].depth_m": 0.0,
      "net_tows[0].lat": 0.0,
      "net_tows[0].lon": 0.0,
      "net_tows[0].angle": 1.0,
      "net_tows[0].flow_counts": 1.0,
      "net_tows[0].volume_filtered": 1.0,
      "net_tows[0].mwo_net": 0.0,
      "net_tows[0].winch_speed": 1.0,
      "net_tows[0].notes_table": 0.0,
      "net_tows[0].notes_notes_page": 0.0,
      "net_tows[0].notes": 0.0,
      "net_tows[1].net_number": 1.0,
      "net_tows[1].time_open_local": 0.0,
      "net_tows[1].time_close_local": 1.0,
      "net_tows[1].time_close_gmt": 1.0,
      "net_tows[1].target_depth_m": 0.0,
      "net_tows[1].depth_max_m": 1.0,
      "net_tows[1].depth_min_m": 1.0,
      "net_tows[1].depth_m": 0.0,
      "net_tows[1].lat": 0.0,
      "net_tows[1].lon": 0.0,
      "net_tows[1].angle": 1.0,
      "net_tows[1].flow_counts": 1.0,
      "net_tows[1].volume_filtered": 0.0,
      "net_tows[1].mwo_net": 0.0,
      "net_tows[1].winch_speed": 0.0,
      "net_tows[1].notes_table": 1.0,
      "net_tows[1].notes_notes_page": 0.0,
      "net_tows[1].notes": 1.0,
      "net_tows[2].net_number": 1.0,
      "net_tows[2].time_open_local": 0.0,
      "net_tows[2].time_close_local": 1.0,
      "net_tows[2].time_close_gmt": 1.0,
      "net_tows[2].target_depth_m": 0.0,
      "net_tows[2].depth_max_m": 1.0,
      "net_tows[2].depth_min_m": 1.0,
      "net_tows[2].depth_m": 0.0,
      "net_tows[2].lat": 0.0,
      "net_tows[2].lon": 0.0,
      "net_tows[2].angle": 1.0,
      "net_tows[2].flow_counts": 0.0,
      "net_tows[2].volume_filtered": 0.0,
      "net_tows[2].mwo_net": 0.0,
      "net_tows[2].winch_speed": 0.0,
      "net_tows[2].notes_table": 0.0,
      "net_tows[2].notes_notes_page": 0.0,
      "net_tows[2].notes": 0.0,
      "net_tows[3].net_number": 1.0,
      "net_tows[3].time_open_local": 0.0,
      "net_tows[3].time_close_local": 1.0,
      "net_tows[3].time_close_gmt": 1.0,
      "net_tows[3].target_depth_m": 0.0,
      "net_tows[3].depth_max_m": 1.0,
      "net_tows[3].depth_min_m": 1.0,
      "net_tows[3].depth_m": 0.0,
      "net_tows[3].lat": 0.0,
      "net_tows[3].lon": 0.0,
      "net_tows[3].angle": 0.8,
      "net_tows[3].flow_counts": 1.0,
      "net_tows[3].volume_filtered": 1.0,
      "net_tows[3].mwo_net": 0.0,
      "net_tows[3].winch_speed": 0.0,
      "net_tows[3].notes_table": 0.0,
      "net_tows[3].notes_notes_page": 0.0,
      "net_tows[3].notes": 0.0
    },
    "uncertain_fields": [
      "header.gmt_date",
      "net_tows[3].angle"
    ],
    "notes": [
      "Only GMT Date is present; Local Date is absent.",
      "Net 3 angle value '35p' may be a misreading or notation error."
    ]
  }
}